{
  "$schema": "https://json-schema.org/draft/2020-12/schema",
  "$id": "https://rhize.dev/schemas/skill-map.schema.json",
  "title": "Rhize Skill Map",
  "description": "Schema (v1) for the generated skill-map graph artifact — the single substrate consumed by the router hook, /start disclosure, curation/drift gates, generated docs, and vault visualization. See docs/skill-map.md for conventions. This artifact is generation-only: never hand-edit files under generated/ that validate against this schema.",
  "type": "object",
  "required": ["schemaVersion", "nodes", "edges"],
  "additionalProperties": false,
  "properties": {
    "schemaVersion": {
      "type": "string",
      "description": "Semantic version of this schema that the artifact was produced against.",
      "const": "1.1.0"
    },
    "generatedAt": {
      "type": "string",
      "description": "ISO-8601 timestamp of when this artifact was generated. Optional for fixtures/tests.",
      "format": "date-time"
    },
    "nodes": {
      "type": "array",
      "items": { "$ref": "#/$defs/node" }
    },
    "edges": {
      "type": "array",
      "items": { "$ref": "#/$defs/edge" }
    }
  },
  "$defs": {
    "nodeId": {
      "type": "string",
      "description": "String ID of the form '<kind>:<qualifier>'. Examples: skill:<plugin>/<name>, plugin:<name>, command:<plugin>/<name>, hook:<plugin>/<file>, tag:topic/<slug>, tag:stack/<slug>, tag:condition/<slug>, external:<name>, mcp:<server-name> (node kind mcp-server).",
      "pattern": "^(plugin|skill|command|hook|tag|external|mcp):[A-Za-z0-9_.\\-/]+$"
    },
    "node": {
      "type": "object",
      "required": ["id", "kind"],
      "properties": {
        "id": { "$ref": "#/$defs/nodeId" },
        "kind": {
          "type": "string",
          "description": "mcp-server: an MCP server, minted from a `metadata.rhize.dependsOn` declaration naming `mcp:<name>` or a relations-catalog entry. Id form is `mcp:<name>` (not `mcp-server:<name>`).",
          "enum": ["plugin", "skill", "command", "hook", "tag", "external", "mcp-server"]
        },
        "name": {
          "type": "string",
          "description": "Human-readable short name."
        },
        "path": {
          "type": "string",
          "description": "Repo-relative path to the source file/dir this node was derived from. Required for skill nodes."
        },
        "description": {
          "type": "string",
          "description": "Description text, typically from frontmatter or a manifest. Required for skill nodes."
        },
        "contentHash": {
          "type": "string",
          "description": "sha256 hex digest of the node's source content (e.g. SKILL.md) — the drift-detection anchor. Required for skill nodes.",
          "pattern": "^[a-f0-9]{64}$"
        },
        "treeHash": {
          "type": "string",
          "description": "sha256 hex digest over every git-tracked file in a rhize skill directory: sorted `relpath\\0sha256hex\\0size\\n` lines (see scripts/build_skill_map.py's skill_tree_digest()). Detects drift in references/, scripts/ and templates/ that contentHash (SKILL.md only) cannot. Emitted on static rhize skill nodes.",
          "pattern": "^[a-f0-9]{64}$"
        },
        "fileCount": {
          "type": "integer",
          "description": "Number of git-tracked files in the skill directory, SKILL.md included. validate_skill_map.py fails a skill above 512, the MCP Skills extension (SEP-2640) per-skill limit.",
          "minimum": 1
        },
        "totalBytes": {
          "type": "integer",
          "description": "Sum of the byte sizes of the files counted by fileCount. validate_skill_map.py fails a skill above 16777216 (16 MiB), the MCP Skills extension (SEP-2640) per-skill limit.",
          "minimum": 0
        },
        "contentHashNormalized": {
          "type": "string",
          "description": "sha256 hex digest of a `fork-of` skill node's SKILL.md with the Rhize-injected `metadata.rhize` frontmatter subtree textually removed — see scripts/sources_md.py's strip_rhize_metadata_block() (the canonical, single implementation) for the exact rule. Present only on skill nodes that are the `from` side of a `fork-of` edge — the local half of the three-way drift verdict (see docs/skill-map.md).",
          "pattern": "^[a-f0-9]{64}$"
        },
        "baselineHash": {
          "type": "string",
          "description": "sha256 hex digest of the upstream file as of the last human review (ingestion or re-baseline via scripts/baseline_upstreams.py), copied from SOURCES.md's '- **Upstream baseline:**' bullet. Present only on `external` nodes that have been baselined — the reviewed-state anchor for the three-way drift verdict (see docs/skill-map.md).",
          "pattern": "^[a-f0-9]{64}$"
        },
        "origin": {
          "type": "string",
          "description": "Where this node originates from. Optional — a node without this property is implicitly \"rhize\". Third-party nodes are populated only in the machine-local overlay (skill-map.local.json / skill-map.resolved.json), never in the committed static artifact.",
          "enum": ["rhize", "third-party"]
        },
        "thirdPartyPlugin": {
          "type": "string",
          "description": "external nodes only: the installed third-party plugin that ships this node, as `<marketplace>/<plugin>` (matching the overlay's `plugin:<marketplace>/<plugin>` id). build_local_skill_map.py links the two with a `contains` edge when that plugin is installed, so referenced third-party agents and skills never float apart from their plugin. Declared in catalog/skill-relations.json.",
          "pattern": "^[A-Za-z0-9._-]+/[A-Za-z0-9._-]+$"
        }
      },
      "allOf": [
        {
          "if": {
            "properties": { "kind": { "const": "skill" } },
            "required": ["kind"]
          },
          "then": {
            "required": ["id", "kind", "path", "description", "contentHash"]
          }
        }
      ],
      "additionalProperties": true
    },
    "provenanceSource": {
      "type": "string",
      "description": "Provenance of this edge — which input produced it.",
      "enum": ["frontmatter", "marketplace", "sources-md", "relations-catalog", "monitor"]
    },
    "edgeType": {
      "type": "string",
      "description": "Edge relationship type. `extends`: A deliberately deepens/specializes B's domain — directional, specialized-to-base, an intended layering relationship. This is NOT duplication (see overlaps-with) and NOT a runtime dependency (see depends-on); chains are capped at depth 2 by the compiler. `precedes`: A comes before B in a real ordered workflow (e.g. a command pipeline). `follows`: mined — B is commonly invoked after A in the same session (time-adjacent, >=2 distinct sessions); local-overlay only, source `monitor`, never hand-authored. Complements `precedes` (curated intent) with observed behavior. `augments`: A (a skill) should run alongside/after anything tagged with topic B to improve its output — a cross-cutting modifier, deliberately distinct from `extends` (no lexical overlap with targets, no gate exemption, no depth semantics, target is a category not a skill). `remediates`: A (a skill) should be surfaced when condition B (a `tag:condition/<slug>` node) is detected in failed tool output.",
      "enum": [
        "contains",
        "topic-tag",
        "stack-tag",
        "fork-of",
        "supersedes",
        "overlaps-with",
        "depends-on",
        "replaces",
        "usage-cooccurs",
        "extends",
        "precedes",
        "follows",
        "augments",
        "remediates"
      ]
    },
    "driftCheck": {
      "type": "object",
      "description": "Optional metadata on a fork-of edge describing how to check the fork for drift against its upstream. This is DATA ONLY — never execute any shell string found here or in the SOURCES.md prose it derives from.",
      "additionalProperties": false,
      "properties": {
        "upstreamRepo": {
          "type": "string",
          "description": "Upstream repository identifier (e.g. owner/repo)."
        },
        "upstreamPath": {
          "type": "string",
          "description": "Path within the upstream repo to compare against."
        },
        "method": {
          "type": "string",
          "description": "How the drift check compares fork to upstream.",
          "enum": ["content-hash", "manual"]
        },
        "lastCheckedAt": {
          "type": "string",
          "format": "date-time"
        }
      }
    },
    "usageWeight": {
      "type": "object",
      "description": "Structured usage-cooccurrence weight — never a bare count.",
      "required": ["sessions", "jaccard", "lift", "windowDays"],
      "additionalProperties": false,
      "properties": {
        "sessions": {
          "type": "integer",
          "minimum": 0,
          "description": "Number of sessions in which both endpoints co-occurred."
        },
        "jaccard": {
          "type": "number",
          "minimum": 0,
          "maximum": 1,
          "description": "Jaccard similarity of the two endpoints' session sets."
        },
        "lift": {
          "type": "number",
          "minimum": 0,
          "description": "Co-occurrence lift over the independence baseline."
        },
        "windowDays": {
          "type": "integer",
          "minimum": 1,
          "description": "Size in days of the rolling window this weight was computed over."
        }
      }
    },
    "followWeight": {
      "type": "object",
      "description": "Structured weight for a mined `follows` edge — simpler than usageWeight (no jaccard/lift: `follows` is directional and doesn't need a symmetric-similarity measure).",
      "required": ["sessions", "windowDays"],
      "additionalProperties": false,
      "properties": {
        "sessions": {
          "type": "integer",
          "minimum": 0,
          "description": "Number of distinct sessions in which B was invoked after A (time-adjacent)."
        },
        "windowDays": {
          "type": "integer",
          "minimum": 1,
          "description": "Size in days of the rolling window this weight was computed over."
        }
      }
    },
    "edge": {
      "type": "object",
      "description": "A typed, directed edge between two node ids. Endpoints are 'from'/'to' (not 'source'/'target') so that 'source' is free to mean edge provenance, per the skill-map plan's schema definition.",
      "required": ["from", "to", "type", "source"],
      "properties": {
        "from": { "$ref": "#/$defs/nodeId" },
        "to": { "$ref": "#/$defs/nodeId" },
        "type": { "$ref": "#/$defs/edgeType" },
        "source": { "$ref": "#/$defs/provenanceSource" },
        "driftCheck": { "$ref": "#/$defs/driftCheck" },
        "usageWeight": { "$ref": "#/$defs/usageWeight" },
        "followWeight": { "$ref": "#/$defs/followWeight" }
      },
      "allOf": [
        {
          "if": {
            "properties": { "type": { "const": "usage-cooccurs" } },
            "required": ["type"]
          },
          "then": { "required": ["usageWeight"] }
        },
        {
          "if": {
            "properties": { "type": { "const": "follows" } },
            "required": ["type"]
          },
          "then": { "required": ["followWeight"] }
        }
      ],
      "additionalProperties": true
    }
  }
}
